{
  "$schema": "../schemas/tlnet.schema.json",
  "ctan": {
    "master": "http://dante.ctan.org/tex-archive/",
    "mirrors": "https://mirrors.ctan.org/",
    "default": "https://mirror.math.princeton.edu/pub/CTAN/",
    "path": "systems/texlive/tlnet/"
  },
  "tlcontrib": {
    "mirrors": "https://mirrors.ctan.org/",
    "path": "systems/texlive/tlcontrib/"
  },
  "historic": {
    "master": "ftp://tug.org/historic/",
    "default": "https://ftp.math.utah.edu/pub/texlive/historic/",
    "path": {
      "systems/texlive/{version}/tlnet/": {
        "versions": "<2010"
      },
      "systems/texlive/{version}/tlnet-final/": {
        "versions": ">=2010"
      }
    }
  },
  "tlpretest": {
    "default": "https://ftp.math.utah.edu/pub/texlive/tlpretest/"
  }
}
